{"base_deals":[{"base_deal_id":"base:sha256:2f6f1a95bb1c8257b15276f2335a9b2c18d6ea073c15917093ceffb446443e35","card_encoding":"project_target_v1_suit_major_hdcs_rank_2_to_ace","dealer":0,"hands":[["JS","8H","9H","5C","4D","8D","10C","5D","KH","7S","AD","9S","3D"],["2C","3S","7H","5S","QD","5H","3H","10S","2D","9D","KS","QH","9C"],["2H","7C","JH","AC","QC","4C","AS","4S","KD","4H","2S","10H","AH"],["3C","KC","6C","6S","6D","JD","8S","JC","QS","7D","10D","8C","6H"]],"index":0,"ruleset_id":"project_target_v1","schema_version":"tuppi.eval.base_deal.v1","starting_score":[0,0]}],"content_digest":"sha256:3146a054c7519d5f0fd7fcdf1d6b7962f8b5383fdd30b33c022dc6d06ada09f6","creation_metadata":{"created_by":"examples/evaluation/generate_examples.py","purpose":"small_ci_fixture"},"deal_bank_id":"bank:sha256:3146a054c7519d5f0fd7fcdf1d6b7962f8b5383fdd30b33c022dc6d06ada09f6","dealer_policy":"round_robin","generator_id":"tuppi.eval.sha256_fisher_yates","generator_version":"1.0.0","initial_dealer":0,"root_seed":1729,"ruleset_id":"project_target_v1","schema_version":"tuppi.eval.deal_bank.v1","shuffle_algorithm":"sha256_counter_fisher_yates_modulo_v1"}
